,Namn,1 vecka,1 mån,3 mån,i år,1 år,3 år,5 år,Return ranking sum,return ranking,avg return ranking,never returned negative
464,iShares S&P 500 Utilities Sector UCITS ETF,4.03,-2.37,-6.98,-10.18,-8.36,19.99,,3270.0,722.0,727.0,False
465,iShares S&P SmallCap 600 UCITS ETF USD (Dist),-2.16,-3.08,-8.83,-18.96,-12.46,6.02,23.29,4707.0,930.0,887.0,False
466,iShares S&P U.S. Banks UCITS ETF USD (Acc),-0.58,0.45,-19.41,-36.72,-26.01,,,3977.0,851.0,956.0,False
467,iShares SMI (DE),1.81,2.01,1.77,-2.78,4.25,19.07,23.96,1552.0,108.0,52.0,False
468,iShares Spain Govt Bond UCITS ETF EUR (Dist),0.49,-0.47,1.67,1.53,-0.69,10.13,14.72,2452.0,447.0,258.0,False
469,iShares STOXX Europe 50 UCITS ETF (DE),1.76,1.92,-3.06,-11.71,-6.15,-1.77,-4.3,3282.0,724.0,598.0,False
470,iShares STOXX Europe 50 UCITS ETF EUR (Dist),1.74,0.98,-2.78,-12.58,-6.27,-1.96,-1.8,3455.0,760.0,637.0,False
471,iShares STOXX Europe 600 Automobiles & Parts UCITS ETF (DE),6.02,10.65,5.48,-12.21,-6.85,-21.32,-18.78,2568.0,493.0,305.0,False
472,iShares STOXX Europe 600 Banks UCITS ETF (DE),0.45,0.92,-13.71,-37.55,-28.19,-48.84,-54.68,4788.0,940.0,899.0,False
473,iShares STOXX Europe 600 Basic Resources UCITS ETF (DE),0.35,3.06,1.88,-8.71,0.32,-2.76,37.26,2330.0,409.0,228.0,False
474,iShares STOXX Europe 600 Chemicals UCITS ETF (DE),2.69,4.85,9.37,5.79,16.3,22.02,30.44,499.0,6.0,5.0,True
475,iShares STOXX Europe 600 Construction & Materials UCITS ETF (DE),1.01,2.36,1.81,-8.83,1.61,5.84,24.58,2090.0,313.0,165.0,False
476,iShares STOXX Europe 600 Financial Services UCITS ETF (DE),-0.11,-0.87,1.16,-5.82,4.46,21.01,26.17,2800.0,566.0,402.0,False
477,iShares STOXX Europe 600 Food & Beverage UCITS ETF (DE),2.05,2.77,-1.66,-11.64,-15.92,4.66,20.41,2826.0,575.0,417.0,False
478,iShares STOXX Europe 600 Health Care UCITS ETF (DE),2.11,0.97,-1.74,-1.43,6.72,21.84,14.32,2010.0,276.0,137.0,False
479,iShares STOXX Europe 600 Industrial Goods & Services UCITS ETF (DE),1.71,2.71,4.66,-7.54,2.08,11.76,33.18,1558.0,110.0,53.0,False
480,iShares STOXX Europe 600 Insurance UCITS ETF (DE),1.33,2.73,-5.3,-20.17,-10.56,-5.18,-3.69,3576.0,787.0,671.0,False
481,iShares STOXX Europe 600 Media UCITS ETF (DE),2.55,3.28,-4.5,-19.73,-16.7,-5.28,-22.6,3497.0,768.0,646.0,False
482,iShares STOXX Europe 600 Oil & Gas UCITS ETF (DE),-0.71,-0.95,-15.72,-36.26,-32.46,-27.76,-22.23,5403.0,969.0,952.0,False
483,iShares STOXX Europe 600 Personal & Household Goods UCITS ETF (DE),2.76,4.67,1.32,-5.12,-1.05,-0.64,17.19,1953.0,249.0,124.0,False
484,iShares STOXX Europe 600 Real Estate UCITS ETF (DE),0.67,0.34,-3.35,-17.04,-6.09,-4.05,-10.63,3964.0,850.0,767.0,False
485,iShares STOXX Europe 600 Retail UCITS ETF (DE),0.12,2.77,2.43,-4.03,11.59,19.82,0.96,1914.0,227.0,116.0,False
486,iShares STOXX Europe 600 Technology UCITS ETF (DE),-3.1,-0.4,4.94,7.76,18.31,35.84,80.21,1934.0,239.0,119.0,False
487,iShares STOXX Europe 600 Telecommunications UCITS ETF (DE),2.21,1.09,-7.4,-16.61,-15.9,-26.11,-45.82,4014.0,858.0,778.0,False
488,iShares STOXX Europe 600 Travel & Leisure UCITS ETF (DE),-0.82,3.33,-9.24,-33.85,-26.32,-28.98,-30.8,4593.0,919.0,870.0,False
489,iShares STOXX Europe 600 UCITS ETF (DE),1.06,1.72,-1.52,-11.12,-4.97,-2.17,0.75,3264.0,718.0,592.0,False
490,iShares STOXX Europe 600 Utilities UCITS ETF (DE),0.6,-1.61,1.0,-0.73,6.97,17.03,18.04,2473.0,455.0,266.0,False
491,iShares STOXX Europe Large 200 UCITS ETF (DE),1.29,1.87,-1.58,-11.04,-5.5,-2.37,-1.17,3209.0,699.0,566.0,False
492,iShares STOXX Europe Mid 200 UCITS ETF (DE),1.07,0.93,-1.87,-13.14,-5.3,-3.0,6.12,3470.0,764.0,642.0,False
493,iShares STOXX Europe Select Dividend 30 UCITS ETF (DE),2.27,1.3,-8.31,-23.72,-14.27,-11.83,-12.07,3936.0,843.0,759.0,False
494,iShares STOXX Europe Small 200 UCITS ETF (DE),0.11,1.85,2.05,-8.43,0.65,3.87,13.12,2558.0,491.0,301.0,False
495,iShares STOXX Global Select Dividend 100 UCITS ETF (DE),1.24,2.06,-8.73,-22.84,-17.56,-13.61,-7.78,3951.0,847.0,763.0,False
496,iShares Sustainable MSCI Japan SRI EUR Hedged UCITS ETF ,-0.49,2.09,0.32,-3.11,11.64,10.9,,2052.0,297.0,243.0,False
497,iShares TecDAX  UCITS ETF (DE),-1.0,1.13,-3.24,2.09,7.37,30.42,75.11,2273.0,384.0,212.0,False
498,iShares Thomson Reuters Inclusion and Diversity UCITS ETF,1.19,2.31,-2.37,-11.13,-2.5,,,2296.0,394.0,568.0,False
499,iShares UK Dividend UCITS ETF GBP (Dist),-0.13,1.44,-13.39,-35.52,-24.55,-36.51,-49.88,4860.0,947.0,911.0,False
500,iShares US Aggregate Bond UCITS ETF USD (Dist),1.04,-1.27,-2.97,0.02,-3.01,8.62,3.25,3221.0,702.0,570.0,False
501,iShares USD Corp Bond 0-3yr ESG UCITS ETF EUR Hedged (Acc),-0.07,-0.29,0.0,1.68,1.76,,,2251.0,371.0,545.0,False
502,iShares USD Corp Bond ESG UCITS ETF EUR Hedged (Dist),-0.23,-1.71,2.48,,,,,1744.0,163.0,792.0,False
503,iShares USD Treasury Bond 3-7yr UCITS ETF EUR Hedged (Dist),-0.06,-1.02,-0.1,4.18,2.69,,,2302.0,396.0,571.0,False
504,iShares USD Treasury Bond 3-7yr UCITS ETF USD (Dist),1.04,-1.24,-4.36,-0.39,-2.38,,,2702.0,523.0,717.0,False
505,iShares USD Treasury Bond 7-10yr UCITS ETF EUR Hedged (Dist),-0.02,-0.77,1.41,9.1,4.63,,,1948.0,246.0,363.0,False
506,iShares USD Treasury Bond 7-10 yr UCITS ETF USD (Acc),0.06,-0.7,1.71,11.25,9.16,19.13,25.36,2080.0,308.0,163.0,False
507,iShares US Equity Buyback Achievers UCITS ETF ,-1.2,1.57,-11.51,-21.57,-10.69,3.22,16.17,4166.0,880.0,814.0,False
508,iShares US Mortgage Backed Securities UCITS ETF ,1.07,-0.29,-5.44,-3.21,-5.28,2.6,,3141.0,683.0,691.0,False
509,iShares US Property Yield UCITS ETF USD (Dist),1.15,-1.15,-12.12,-24.2,-26.73,-13.11,-7.07,4720.0,932.0,888.0,False
512,JPM BetaBuilders EUR Govt Bond 1-3 yr UCITS ETF - EUR (acc),0.03,-0.02,0.18,-0.14,-0.74,,,2322.0,404.0,582.0,False
513,JPM BetaBuilders EUR Govt Bond UCITS ETF,-0.54,-0.53,2.64,1.91,-0.72,,,2212.0,356.0,522.0,False
514,JPM BetaBuilders US Equity UCITS ETF,0.78,2.57,7.51,0.16,7.55,,,949.0,19.0,33.0,True
515,JPM BetaBuilders US Equity UCITS ETF      ,-1.78,2.56,2.13,1.49,11.43,,,1485.0,89.0,162.0,False
516,JPM BetaBuilders US Treasury Bond 0-1yr UCITS ETF - USD (acc),0.41,-3.2,-8.45,-4.75,-5.31,,,3339.0,736.0,882.0,False
517,JPM BetaBuilders US Treasury Bond 1-3 yr UCITS ETF - USD (acc),1.07,-0.32,-4.78,-2.34,-3.37,,,2682.0,517.0,708.0,False
518,JPM BetaBuilders US Treasury Bond UCITS ETF      ,0.36,-1.3,-2.96,1.29,-0.02,,,2541.0,483.0,665.0,False
519,JPM EUR Corporate Bond 1-5 yr Research Enhanced Index UCITS ETF,0.91,0.91,2.45,0.13,-0.32,,,1582.0,123.0,195.0,False
520,JPM EUR Corporate Bond Research Enhanced Index UCITS ETF,0.23,-0.01,2.38,0.39,-0.37,,,1920.0,230.0,340.0,False
521,JPM Europe Research Enhanced Index Equity (ESG) UCITS ETF - EUR (acc),1.54,2.64,-0.11,-5.71,0.27,,,1633.0,134.0,218.0,False
522,JPM EUR Ultra-Short Income UCITS ETF - EUR (acc),0.04,0.06,0.2,-0.24,-0.38,,,2254.0,376.0,551.0,False
523,JPM Global Emerging Markets Research Enhanced Index Equity (ESG) UCITS ETF,-1.23,0.65,6.26,-7.12,0.88,,,2191.0,347.0,511.0,False
524,JPM Global Equity Multi-Factor UCITS ETF - USD (acc),-0.97,1.02,-3.19,-10.3,-1.22,,,2994.0,627.0,821.0,False
525,JPM Global High Yield Corporate Bond Multi-Factor UCITS ETF - USD (acc),-0.38,-0.38,-0.38,,,,,1904.0,222.0,855.0,False
526,JPM Global Research Enhanced Index Equity (ESG) UCITS ETF - USD (acc),-1.12,1.91,5.15,-1.8,10.67,,,1576.0,120.0,192.0,False
527,JPM Managed Futures UCITS ETF - EUR Hedged (acc),0.48,0.48,1.12,-16.56,-19.16,,,2863.0,585.0,775.0,False
528,JPMorgan Managed Futures UCITS ETF - USD (acc),0.56,0.16,-2.19,-20.34,-22.43,,,3260.0,717.0,867.0,False
529,JPM USD Corporate Bond Research Enhanced Index UCITS ETF,0.37,-2.18,-2.14,1.32,1.24,,,2474.0,456.0,640.0,False
530,JPM USD Emerging Markets Sovereign Bond UCITS ETF,0.82,0.38,-1.45,-8.47,-9.74,,,2750.0,541.0,741.0,False
531,JPM USD Emerging Markets Sovereign Bond UCITS ETF - EUR Hedged (acc),-0.27,0.38,3.14,-2.0,-1.45,,,2207.0,355.0,519.0,False
532,JPM USD Emerging Markets Sovereign Bond UCITS ETF - USD (acc),0.49,0.8,0.67,-6.28,,,,1803.0,183.0,550.0,False
533,JPM USD Ultra-Short Income UCITS ETF,-0.51,0.16,-3.9,-4.8,-6.13,,,3123.0,672.0,846.0,False
534,JPM USD Ultra-Short Income UCITS ETF,-0.37,-3.28,-3.28,-3.56,-3.9,,,3356.0,740.0,885.0,False
535,JPM US Equity Multi-Factor UCITS ETF - USD (acc),-1.98,-0.07,7.38,-7.88,-4.7,,,2716.0,527.0,723.0,False
536,JPM US Research Enhanced Index Equity (ESG) UCITS ETF - USD (acc),-1.8,3.03,2.93,3.22,13.5,,,1311.0,54.0,100.0,False
537,JPM US Research Enhanced Index Equity (ESG) UCITS ETF - USD (dist),-1.77,1.88,2.84,2.34,,,,1427.0,75.0,275.0,False
538,KMEFIC FTSE Kuwait Equity UCITS ETF,8.05,8.05,2.07,-20.99,-18.55,,,1905.0,223.0,331.0,False
539,Lyxor 1 DAX 50 ESG UCITS ETF (I),2.02,4.45,3.96,,,,,283.0,3.0,8.0,True
540,Lyxor 1 TecDAX UCITS ETF (I),-0.94,0.42,-3.85,1.28,6.66,27.59,,2437.0,440.0,423.0,False
541,Lyxor Australia (S&P/ASX 200) UCITS ETF - Dist,-0.71,0.51,-4.28,-13.6,-11.96,-5.64,10.79,4251.0,888.0,829.0,False
542,Lyxor Barclays Floating Rate Euro 0-7Y UCITS ETF - Acc,-0.05,-0.01,0.37,-0.29,-0.21,-0.6,0.05,3097.0,666.0,523.0,False
543,Lyxor Bofaml Eur High Yield Ex-Financial Bond UCITS ETF - Dist,0.32,1.29,-2.39,-5.49,-4.19,-6.83,-6.57,3562.0,783.0,667.0,False
544,Lyxor Commodities Thomson Reuters/CoreCommodity CRB EX-Agriculture TR UCITS ETF - Acc,-3.99,-1.63,5.58,-22.17,-22.03,-11.02,,4137.0,876.0,905.0,False
545,Lyxor Commodities Thomson Reuters/CoreCommodity CRB EX-Energ,-0.28,3.52,5.56,-7.16,0.31,,,1742.0,161.0,255.0,False
546,Lyxor Commodities Thomson Reuters/CoreCommodity CRB TR UCITS,-3.69,-0.69,1.85,-26.01,-20.06,,,3692.0,812.0,942.0,False
547,Lyxor Core Euro STOXX 300 (DR) - UCITS ETF Acc,1.24,2.33,0.22,-8.29,-1.41,,,1930.0,235.0,348.0,False
548,Lyxor Core Euro Stoxx 50 (DR) - UCITS ETF Acc,1.53,2.26,-0.45,-8.93,-1.9,,,2003.0,272.0,406.0,False
550,Lyxor Core Morningstar UK NT (DR) UCITS ETF,0.39,0.02,-9.19,-25.09,-17.34,,,3581.0,789.0,925.0,False
551,Lyxor Core Morningstar US Equity (DR) UCITS ETF,-2.51,1.34,0.86,0.23,7.21,,,2035.0,285.0,425.0,False
552,Lyxor Core MSCI EMU (DR) UCITS ETF- Dist,1.32,2.88,-2.04,-11.18,-5.01,,,2250.0,370.0,543.0,False
553,Lyxor Core MSCI Japan (DR) UCITS ETF,0.73,3.05,-2.88,-7.16,0.6,,,2010.0,276.0,409.0,False
554,Lyxor Core MSCI World (DR) UCITS ETF,-1.43,1.63,0.97,-2.76,4.45,,,2074.0,304.0,444.0,False
555,Lyxor Core STOXX Europe 600 (DR) UCITS ETF - Acc,1.25,1.9,-0.39,-9.84,-2.14,,,2150.0,337.0,488.0,False
556,Lyxor Core STOXX Europe 600 (DR) - UCITS ETF Monthly Hedged to EUR - Dist,1.53,1.86,-2.02,-10.33,-4.65,-3.75,,2785.0,552.0,581.0,False
557,Lyxor Core US TIPS (DR) UCITS ETF - Dist,0.69,-0.2,-0.3,3.06,1.39,16.69,,2112.0,323.0,265.0,False
558,Lyxor Daily LevDAX UCITS ETF - Acc,3.89,8.7,5.0,-10.41,5.29,-3.99,24.12,1664.0,139.0,67.0,False
560,Lyxor DAX (DR) UCITS ETF - Acc,2.07,4.45,3.17,-0.54,8.06,5.96,25.72,1206.0,38.0,23.0,False
561,Lyxor ETF Daily Double Short Bund,-0.89,0.57,-3.69,-7.48,-0.77,-23.74,-39.03,4023.0,860.0,783.0,False
562,Lyxor ETF Daily Leveraged Bund,0.81,-0.83,3.14,5.6,-2.4,21.73,45.43,2129.0,327.0,174.0,False
563,Lyxor ETF Daily Short DAX x2 ,-4.61,-9.62,-10.71,-25.78,-38.52,-47.21,-71.26,5800.0,975.0,963.0,False
564,Lyxor ETF DJ Industrial Average,-0.65,2.62,-2.74,-7.18,-1.98,30.81,60.79,2731.0,534.0,368.0,False
565,Lyxor ETF EURO Cash EONIA,-0.02,-0.06,-0.17,-0.47,-0.67,-1.76,-2.52,3252.0,712.0,585.0,False
566,Lyxor ETF EURO STOXX 50,1.54,2.36,-2.24,-11.4,-4.53,-3.86,1.38,3123.0,672.0,529.0,False
567,Lyxor ETF EURO STOXX 50 Daily Double Short,-3.49,-5.74,-3.76,-7.91,-23.12,-43.91,-67.12,5227.0,962.0,944.0,False
568,Lyxor ETF EURO STOXX 50 Daily Short,-1.72,-2.79,-1.36,-0.04,-8.53,-21.1,-37.83,4377.0,906.0,848.0,False
569,Lyxor ETF FTSE ATHEX 20,-1.69,-0.56,-7.15,-32.82,-28.12,-27.75,-24.29,5307.0,965.0,948.0,False
570,Lyxor ETF Japan (Topix),0.85,3.4,-3.91,-8.75,-1.51,3.79,16.35,2794.0,562.0,400.0,False
571,Lyxor ETF Leveraged EURO STOXX 50,2.98,4.38,-2.21,-26.34,-14.3,-4.84,11.55,3162.0,688.0,554.0,False
572,Lyxor ETF MSCI Emerging Markets,-1.2,-0.29,4.12,-7.24,2.1,6.59,40.61,2804.0,568.0,405.0,False
573,Lyxor ETF MSCI Europe,1.4,2.02,-2.29,-12.36,-5.83,-3.65,-0.18,3264.0,718.0,592.0,False
574,Lyxor ETF MSCI India,-0.16,2.07,10.07,-11.68,-3.94,-1.05,17.29,2832.0,576.0,420.0,False
575,Lyxor ETF MSCI USA,-2.52,1.42,1.4,0.79,8.23,42.57,66.16,1973.0,259.0,128.0,False
576,Lyxor ETF MSCI World,-1.5,1.56,-0.19,-3.87,3.15,24.09,38.89,2554.0,488.0,299.0,False
577,Lyxor ETF New Energy,0.44,0.27,9.87,16.65,31.36,65.11,104.44,1044.0,24.0,15.0,True
578,Lyxor ETF World Water,0.81,0.86,-0.3,-5.73,3.87,19.49,41.0,2278.0,389.0,215.0,False
579,Lyxor EUR 2-10Y Inflation Expectations UCITS ETF - Acc,-0.45,-0.6,0.04,-3.22,-2.49,-6.98,,3394.0,747.0,766.0,False
580,Lyxor Euro Government Bond (DR) UCITS ETF,0.37,-0.51,2.11,2.56,-0.48,9.68,14.42,2393.0,426.0,242.0,False
581,Lyxor Euro Government Bond 10-15Y (DR) UCITS ETF,0.29,-0.73,3.07,3.41,0.13,15.08,23.45,2266.0,382.0,210.0,False
582,Lyxor Euro Government Bond 1-3Y (DR) UCITS ETF,0.02,-0.05,0.11,-0.24,-0.82,-1.09,-1.17,3168.0,690.0,558.0,False
583,Lyxor Euro Government Bond 15+Y (DR) UCITS ETF,0.97,-1.51,5.44,7.2,0.29,29.35,,1745.0,164.0,145.0,False
584,Lyxor Euro Government Bond 3-5Y (DR) UCITS ETF,0.16,-0.1,0.58,0.51,-0.87,0.8,2.96,2974.0,618.0,474.0,False
585,Lyxor Euro Government Bond 5-7Y (DR) UCITS ETF,0.17,-0.25,1.12,1.39,-0.72,5.12,,2423.0,436.0,418.0,False
586,Lyxor Euro Government Inflation Linked Bond (DR) UCITS ETF - Acc,-0.21,-1.23,2.79,-0.53,-2.51,5.54,11.05,3129.0,675.0,532.0,False
587,LyxorEuroMTS 7-10Y Investment Grade (DR) UCITS ETF - Acc,0.31,-0.4,1.86,2.32,-0.69,10.25,,2194.0,350.0,303.0,False
588,LyxorEuroMTS Highest Rated Macro-Weighted Govt Bond (DR)UCITS ETF-Acc,0.41,-0.5,1.67,2.43,-1.21,7.72,,2276.0,388.0,328.0,False
589,Lyxor Fed Funds US Dollar Cash UCITS ETF,1.1,0.22,-5.42,-5.97,-6.57,2.47,-4.08,3545.0,778.0,658.0,False
591,Lyxor FTSE EPRA/NAREIT Global Developed UCITS ETF Dist EUR,1.01,0.66,-11.34,-23.74,-23.9,,,3392.0,746.0,896.0,False
592,Lyxor German Mid-Cap MDAX UCITS ETF - Dist,0.0,1.46,0.77,-4.35,4.09,3.03,23.88,2558.0,491.0,301.0,False
593,Lyxor Global Gender Equality (DR) UCITS ETF - Acc,0.14,2.29,-2.66,-10.53,-1.02,,,2500.0,464.0,647.0,False
594,Lyxor Green Bond (DR) UCITS ETF - Acc,0.3,-0.9,0.75,,,,,1681.0,145.0,754.0,False
595,Lyxor Green Bond (DR) UCITS ETF - Monthly Hedged to EUR - Acc,0.09,-0.91,1.76,2.81,0.67,,,2064.0,303.0,438.0,False
596,Lyxor Green Bond ESG Screened (DR) UCITS ETF - Acc,0.32,-0.8,0.92,2.58,,,,1756.0,167.0,512.0,False
597,Lyxor Hwabao WP MSCI China A (DR) UCITS ETF - Acc,-4.08,-2.09,14.99,16.16,19.04,,,1918.0,229.0,339.0,False
598,Lyxor iBoxx Liquid Emerging Markets Sovereigns UCITS ETF-Dist,0.96,-1.31,-5.32,-9.6,-10.01,-5.54,-5.93,4249.0,887.0,827.0,False
599,Lyxor Index Fund-Lyxor FTSE EPRA/NAREIT Developed Europe UCITS ETF,0.8,0.29,-4.93,-18.05,-6.62,,,3108.0,671.0,843.0,False
600,Lyxor Index Fund-Lyxor FTSE EPRA/NAREIT United States UCITS ETF,1.15,-0.55,-13.79,-24.29,-27.19,,,3667.0,805.0,938.0,False
601,Lyxor Index Fund-Lyxor Privex UCITS ETF,0.65,2.65,-5.82,-13.68,-5.91,,,2730.0,533.0,730.0,False
602,Lyxor Index Fund-Lyxor Stoxx Europe 600 Auto. & Parts UCITS ETF- Acc,6.1,10.65,5.74,-11.91,-5.77,,,1469.0,84.0,154.0,False
603,Lyxor Index Fund - Lyxor Stoxx Europe 600 Banks UCITS ETF - Acc,0.43,0.95,-13.38,-36.39,-26.51,,,3614.0,799.0,933.0,False
604,Lyxor Index Fund-Lyxor Stoxx Europe 600 Basic Resources UCITS ETF-Acc,0.47,1.67,3.58,-6.59,4.12,,,1631.0,133.0,216.0,False
605,Lyxor Index Fund-Lyxor Stoxx Europe 600 Chemicals UCITS ETF- Acc,2.7,5.27,9.85,6.65,18.27,,,210.0,1.0,1.0,True
606,Lyxor Index Fund-Lyxor Stoxx Europe 600 Const.& Mat.UCITS ETF- Acc,1.05,2.35,1.72,-8.25,3.17,,,1568.0,114.0,186.0,False
607,Lyxor Index Fund - Lyxor Stoxx Europe 600 Financ Serv UCITS ETF - ACC,0.0,-0.88,1.8,-4.45,6.78,,,2297.0,395.0,569.0,False
608,Lyxor Index Fund -Lyxor Stoxx Europe 600 Food & Beverage UCITS ETF-Acc,2.14,2.7,-1.27,-10.98,-15.1,,,2252.0,374.0,548.0,False
609,Lyxor Index Fund - Lyxor Stoxx Europe 600 Healthcare UCITS ETF - Acc,2.11,0.98,-1.26,-0.16,8.25,,,1483.0,88.0,161.0,False
610,Lyxor Index Fund - Lyxor Stoxx Europe 600 Indus Goods & Services - Acc,-0.13,3.66,4.03,-6.64,3.0,,,1648.0,136.0,224.0,False
611,Lyxor Index Fund-Lyxor Stoxx Europe 600 Insurance UCITS ETF- Acc,1.46,2.82,-3.77,-18.22,-4.95,,,2435.0,439.0,619.0,False
612,Lyxor Index Fund-Lyxor Stoxx Europe 600 Media UCITS ETF- Acc,0.81,5.69,-3.65,-18.66,-15.31,,,2670.0,513.0,704.0,False
613,Lyxor Index Fund-Lyxor Stoxx Europe 600 Oil & Gas UCITS ETF- Acc,-0.66,-1.11,-14.6,-33.76,-29.29,,,4306.0,898.0,972.0,False
614,Lyxor Index Fund-Lyxor Stoxx Europe 600 Pers.& Hou Good UCITS ETF- Acc,2.78,4.76,0.38,-3.5,0.95,,,1250.0,45.0,79.0,False
615,Lyxor Index Fund-Lyxor Stoxx Europe 600 Retail UCITS ET- Acc,0.24,2.01,2.66,-1.65,14.67,,,1347.0,58.0,110.0,False
616,Lyxor Index Fund- Lyxor Stoxx Europe 600 Technology UCITS ETF-Acc,-3.08,-0.4,5.08,8.11,22.16,,,1825.0,195.0,300.0,False
617,Lyxor Index Fund - Lyxor Stoxx Europe 600 Telecommun UCITS ETF - Acc,2.29,2.05,-7.23,-15.05,-13.12,,,2664.0,511.0,703.0,False
618,Lyxor Index Fund Lyxor Stoxx Europe 600 Trvl. & Leisure UCITS ETF- Acc,-0.81,3.04,-9.11,-32.03,-24.58,,,3493.0,767.0,913.0,False
619,LYXOR INDEX FUND Lyxor Stoxx Europe 600 Utilities UCITS ETF-Acc,0.65,-1.57,1.41,0.84,8.74,,,1864.0,208.0,313.0,False
620,Lyxor Index Fund-Lyxor STOXX Europe Select Dividend 30 UCITS ETF,2.3,1.26,-10.05,-24.48,-15.27,,,3005.0,631.0,824.0,False
621,Lyxor Inverse EUR 2-10Y Inflation Expectations UCITS ETF - Acc,-2.03,-2.03,-2.03,0.35,0.35,,,2953.0,609.0,807.0,False
622,Lyxor Inverse USD 10Y Inflation Expectations UCITS ETF - Acc,1.74,-1.27,-11.5,-4.26,-7.19,,,3032.0,642.0,826.0,False
623,Lyxor JPX-Nikkei 400 (DR) UCITS ETF - Daily Hedged to EUR - Dist,4.01,4.01,-2.77,-6.9,,,,1305.0,53.0,217.0,False
624,Lyxor MSCI Canada UCITS ETF - Dist,-1.08,0.64,-2.36,-12.49,-9.05,-0.17,10.37,4021.0,859.0,782.0,False
625,Lyxor MSCI China UCITS ETF - Acc,-3.51,0.25,10.03,8.31,19.33,,,1586.0,124.0,199.0,False
626,Lyxor MSCI Digital Economy ESG Filtered (DR) UCITS ETF - Acc,-5.67,-3.11,5.72,,,,,1996.0,268.0,877.0,False
627,Lyxor MSCI Disruptive Technology ESG Filtered (DR) UCITS ETF - Acc,-4.87,-3.52,3.37,,,,,2074.0,304.0,906.0,False
628,Lyxor MSCI Emerging Markets Asia UCITS ETF - Acc,-1.43,-0.3,7.24,1.1,12.91,,,1812.0,188.0,293.0,False
629,Lyxor MSCI Emerging Markets ex China UCITS ETF - Acc,0.64,-0.51,0.86,-14.51,-6.0,,,2889.0,595.0,789.0,False
630,Lyxor MSCI EM ESG Trend Leaders UCITS ETF - Acc,-1.54,-0.11,6.94,-2.82,7.66,,,2056.0,300.0,434.0,False
631,Lyxor MSCI EMU ESG Trend Leaders (DR) UCITS ETF - Acc,0.97,1.69,0.28,-7.24,-0.12,,,1955.0,252.0,371.0,False
632,Lyxor MSCI EMU Growth (DR) UCITS ETF - Dist,0.09,1.5,2.12,-4.36,1.73,,,1868.0,210.0,314.0,False
633,Lyxor MSCI EMU Small Cap (DR) UCITS ETF - Dist,0.76,2.2,-0.93,-10.49,-1.61,,,2251.0,371.0,545.0,False
634,Lyxor MSCI EMU Value (DR) UCITS ETF - Dist,2.38,3.4,-5.09,-17.88,-11.4,-21.21,,3044.0,647.0,661.0,False
635,Lyxor MSCI Future Mobility ESG Filtered (DR) UCITS ETF - Acc,-1.78,3.63,2.0,,,,,1143.0,33.0,331.0,False
636,Lyxor MSCI Malaysia UCITS ETF- Acc,-2.82,-7.26,-9.25,-13.93,-11.98,,,4271.0,892.0,971.0,False
637,Lyxor MSCI Millennials ESG Filtered (DR) UCITS ETF - Acc,-2.54,2.0,2.74,,,,,1327.0,56.0,521.0,False
639,Lyxor MSCI Russia UCITS ETF - Acc,-5.06,-7.63,-15.4,-33.52,-23.14,,,4664.0,924.0,976.0,False
641,Lyxor MSCI Smart Cities ESG Filtered (DR) UCITS ETF - Acc,-1.25,-1.94,-0.17,,,,,2155.0,340.0,928.0,False
642,Lyxor MSCI USA ESG Trend  Leaders (DR) UCITS ETF - Acc,-2.69,1.21,1.1,1.31,10.03,,,1926.0,232.0,342.0,False
643,Lyxor MSCI World Communication Services TR UCITS ETF - Acc (EUR),-2.37,0.73,3.23,2.2,8.07,32.64,31.13,1998.0,270.0,135.0,False
644,Lyxor MSCI World Consumer Discretionary TR UCITS ETF - Acc (EUR),-3.12,4.61,8.77,10.36,15.1,54.36,73.47,1152.0,34.0,20.0,False
645,Lyxor MSCI World Consumer Staples TR UCITS ETF - Acc (EUR),1.27,2.5,1.56,-3.33,-2.45,19.27,36.51,1872.0,213.0,106.0,False
646,Lyxor MSCI World Energy TR UCITS ETF - Acc (EUR),-2.5,-5.77,-24.17,-43.03,-39.48,-35.13,-33.27,5781.0,974.0,962.0,False
647,Lyxor MSCI World ESG Trend Leaders (DR) UCITS ETF - Acc,-1.16,1.86,1.44,-1.77,5.57,,,1868.0,210.0,314.0,False
648,Lyxor MSCI World Financials TR UCITS ETF - Acc (EUR),0.12,2.22,-8.26,-23.17,-14.21,-2.65,13.01,3945.0,845.0,761.0,False
649,Lyxor MSCI World Health Care TR UCITS ETF - Acc (EUR),0.42,-0.47,-1.76,-0.11,11.25,36.72,41.99,2270.0,383.0,211.0,False
650,Lyxor MSCI World Industrials TR UCITS ETF - Acc (EUR),0.82,5.52,0.0,-8.04,-1.51,17.02,45.91,2137.0,333.0,178.0,False
651,Lyxor MSCI World Information Technology TR UCITS ETF - Acc (EUR),-5.71,0.93,9.57,18.82,32.35,100.68,179.81,1499.0,95.0,45.0,False
652,Lyxor MSCI World Materials TR UCITS ETF - Acc (EUR),2.37,4.02,6.36,0.72,8.67,19.78,56.39,721.0,13.0,9.0,True
653,Lyxor MSCI World Utilities TR UCITS ETF - Acc (EUR),2.58,-1.88,-5.03,-8.39,-5.39,17.64,41.05,3211.0,700.0,567.0,False
654,Lyxor Multi Units Lux LYXOR EUR Curve Flattening 2-10 UCITS ETF C,-0.13,-0.13,-0.13,-0.13,,,,2047.0,294.0,675.0,False
655,Lyxor Multi Units Lux LYXOR EUR Curve Steepening 2-10 UCITS ETF C,-0.83,-0.83,-0.83,-2.12,,,,2448.0,444.0,836.0,False
656,Lyxor NASDAQ-100 UCITS ETF - Acc,-5.99,1.13,10.84,23.31,35.9,96.06,152.07,1442.0,78.0,40.0,False
657,Lyxor Pan Africa UCITS ETF - Acc,-0.24,0.65,7.14,-7.77,-9.79,-6.15,,3018.0,638.0,652.0,False
658,Lyxor Portfolio Strategy Defensive UCITS ETF,-0.24,0.02,1.49,0.55,2.34,,,2036.0,286.0,426.0,False
659,Lyxor Portfolio Strategy Offensive UCITS ETF,-1.28,1.17,2.47,-2.89,3.85,,,2027.0,282.0,422.0,False
660,Lyxor Portfolio Strategy UCITS ETF,-0.25,1.02,1.86,-2.52,1.18,13.78,,2220.0,361.0,310.0,False
661,Lyxor Robotics & AI UCITS ETF - Acc,-5.23,-0.52,5.0,16.27,26.79,,,1869.0,212.0,318.0,False
662,Lyxor S&P 500 UCITS ETF - Dist (EUR),-2.01,1.58,0.72,-0.25,6.79,40.95,65.45,2101.0,318.0,170.0,False
663,Lyxor S&P 500 VIX Futures Enhanced Roll UCITS ETF - Acc,-1.43,4.25,-1.94,100.12,75.84,23.47,-68.9,2107.0,320.0,171.0,False
664,Lyxor SG Global Quality Income NTR UCITS ETF - Dist,1.04,0.58,-6.6,-15.02,-11.42,-10.58,-9.16,4073.0,864.0,794.0,False
668,Lyxor STOXX Europe 600 Media UCITS ETF-Dist,2.57,4.71,-5.36,-19.94,-15.99,-4.59,-13.39,3448.0,757.0,634.0,False
671,Lyxor UCITS ETF EuroMTS Covered Bond Aggregate - Dist,0.15,0.07,-0.05,0.33,-1.74,,,2322.0,404.0,582.0,False
672,Lyxor UCITS ETF Japan (TOPIX) - Daily Hedged D-EUR,0.11,4.05,-1.41,-6.71,3.9,-2.28,3.48,2743.0,538.0,375.0,False
673,Lyxor US$ 10Y Inflation Expectations UCITS ETF - Acc,0.42,0.64,-1.37,-7.15,-6.44,0.97,,3095.0,665.0,685.0,False
674,Lyxor US Curve Flattening 2-10 UCITS ETF - Acc,-0.07,-1.29,-5.71,-4.28,,,,2749.0,539.0,902.0,False
675,Lyxor US Curve Steepening 2-10 UCITS ETF - Acc,0.55,0.29,-5.87,-7.5,,,,2316.0,402.0,791.0,False
676,MUL Fund-Lyxor China Enterprise (HSCEI) UCITS ETF - Acc,-0.77,-2.43,-4.95,-15.27,-9.33,,,3897.0,839.0,954.0,False
677,MUL - Lyxor Hong Kong (HSI) UCITS ETF - Dist,-0.8,0.79,-5.83,-17.44,-13.38,,,3565.0,784.0,922.0,False
678,MUL - Lyxor MSCI AC Asia Ex Japan UCITS ETF - Acc,-1.29,0.41,6.27,-0.77,8.46,,,1811.0,187.0,292.0,False
679,MUL - Lyxor MSCI AC Asia Pacific Ex Japan UCITS ETF - Acc,-0.99,0.29,4.69,-3.1,5.34,,,2001.0,271.0,403.0,False
680,MUL - Lyxor MSCI Brazil UCITS ETF - Acc,1.45,-0.89,-8.12,-37.68,-29.73,,,3672.0,807.0,939.0,False
681,MUL - Lyxor MSCI Eastern Europe Ex Russia UCITS ETF - Acc,-0.06,-3.02,-6.35,-25.22,-20.88,,,4086.0,866.0,958.0,False
682,MUL - Lyxor MSCI EM Latin America UCITS ETF - Acc,1.0,-0.82,-8.83,-35.01,-28.36,,,3785.0,824.0,947.0,False
683,MUL - Lyxor MSCI Indonesia UCITS ETF - Acc,-2.44,-0.39,-8.36,-27.0,-25.96,,,4222.0,885.0,968.0,False
684,MUL- Lyxor MSCI Korea UCITS ETF - Acc,2.73,0.45,3.79,-1.58,12.63,,,1127.0,31.0,59.0,False
685,MUL - Lyxor MSCI South Africa UCITS ETF - Acc,-0.17,3.39,-1.5,-23.47,-19.15,,,3000.0,629.0,823.0,False
686,MUL - Lyxor MSCI Taiwan UCITS ETF - Acc,0.88,-2.33,9.36,4.28,24.03,,,1364.0,61.0,114.0,False
687,MUL - Lyxor MSCI Thailand UCITS ETF - Acc,0.52,-4.32,-17.01,-27.67,-30.65,,,4110.0,871.0,960.0,False
688,MUL - Lyxor MSCI Turkey UCITS ETF - Acc,0.42,0.1,-18.0,-34.56,-31.62,,,3767.0,819.0,945.0,False
689,Multi Lyxor EurMts Hghst Rtd Macr Wghtd Gvt Bd 3-5Y(DR)UCITS ETF Acc,0.08,-0.09,0.24,0.15,-1.45,0.24,1.44,3128.0,674.0,531.0,False
690,Multi Lyxor EurMts Highst Rtd Macr Wghtd Gvt Bd 5-7Y(DR)UCITS ETF Acc,0.24,-0.12,0.75,1.14,-1.46,4.15,6.21,2852.0,581.0,427.0,False
691,Multi Lyxor Euro Corporate Bond Ex Financials UCITS ETF - Acc,0.39,0.11,1.39,0.7,-0.02,,,1873.0,214.0,320.0,False
692,Multi Lyxor Euro Corporate Bond UCITS ETF - Acc,0.23,0.02,1.21,0.58,-0.19,,,1994.0,267.0,398.0,False
693,Multi Lyxor Euromts Hghst Rtd Macr Wghtd Gvt Bd1-3Y(DR)UCITS ETF Acc,0.01,-0.1,-0.04,-0.48,-1.23,-2.19,-2.46,3312.0,730.0,604.0,False
694,Multi Lyxor Eur Stoxx Banks (DR) Ucits ETF,1.34,2.48,-11.45,-34.98,-24.26,,,3067.0,656.0,839.0,False
695,Multi Units Luxembourg Lyxor MSCI All Country World UCITS ETF EUR C,-1.42,1.35,1.28,-3.46,4.09,27.67,51.3,2290.0,391.0,220.0,False
696,Shares MSCI EMU Large Cap UCITS ETF ,1.38,2.87,-0.74,-10.79,-2.2,4.82,20.87,2535.0,479.0,291.0,False
697,The Medical Cannabis and Wellness UCITS ETF - Acc,-7.38,-3.53,-10.34,,,,,2840.0,578.0,979.0,False
699,VanEck Vectors Emerging Markets High Yield Bond UCITS ETF,1.27,1.66,-0.59,-3.69,1.27,,,1769.0,174.0,268.0,False
700,VanEckVectors European Equal Weight UCITS ETF,1.36,2.04,-3.18,-12.52,-1.21,,,2279.0,390.0,562.0,False
701,VanEckVectors Global Equal Weight UCITS ETF,-0.23,1.93,-2.45,-9.44,-2.67,,,2759.0,543.0,744.0,False
702,VanEck Vectors Global Fallen Angel High Yield Bond UCITS ETF,0.57,-0.91,0.02,2.59,5.27,,,2015.0,280.0,411.0,False
703,VanEck Vectors Global Mining UCITS ETF,0.7,-0.07,13.04,10.03,16.89,,,1067.0,25.0,44.0,False
704,VanEckVectors Global Real Estate UCITS ETF,1.01,1.06,-8.65,-21.02,-22.58,,,3255.0,713.0,864.0,False
